librarian_comments,region,locality,elementary_school,middle_school,high_school
"I had a parent challenge the Bone series. She said it had the main character watching a girl bathe and that they drank beer. It is a graphic novel but it didn't show anything and didn't even state right out that he saw anything. And only the adults drank beer and it wasn't a big part of the story. The town met in the pub for a town meeting as they used to do, and some partook of the drinks available. It went all the way up to the school board because she really wanted it gone. The book won and I didn't have to pull it.",Mountain,Suburban,1,0,0
"I had a parent complain about content in a fiction title that used the f word quite often. I was called in to the Principal's office and told that the title was being pulled. He said, basically, ""no f word."" I sent him the reviews and explained that I wouldn't necessarily know when the word is being used based on what information I am given. End of story. I try to avoid what I consider ""offensive"" words, but I do not consider them damaging to a 14 year old. Would I want my own 6th grader reading those words? No. It is a fine line. I suppose that I, personally, object to profanity over anything else I have encountered in young adult literature. Although, most recently, I purchased the award winning graphic novel This One Summer and pulled it off the shelf after reading it, as I felt it had no socially redeeming value. Self censorship? Maybe. I have to go with my education, experience, and my heart.",Midwest,Rural,0,1,0
"I had Darren Shan's, Demonata series challenged by a parent who believed that horror titles had no place in children's libraries. The family left our public school for private school. I had a parent challenge Unwind, by Neal Shusterman because it promoted abortion (?).",Pacific,Suburban,0,1,0
I have actually had a first grade student tell me that a particular book (The Odyssey: a graphic novel by Hinds) is inappropriate because there is a drawing of a woman who is naked (though she is sitting and her hair covers her up). I've never had a problem with the book though. I had to remind the student that he gets to choose his owns books and we celebrate our intellectual freedom in our library. Everybody makes their own choices as to what they read.,Pacific,Urban,1,1,0
"I have been a librarian for 5 years and have never pulled a book due to a challenge. I have had 2 challenges, but in both cases, I gave the parent our standard challenge form to fill out and the parent never brought it back. So, the case was never pursued.",South Central,Urban,0,1,0
"I have been an elementary school librarian for 10 years now and have only received one book challenge. A parent saw the book her child was reading and read it herself. The parent wrote me a letter that said the book was inappropriate for school because it was calling people fat and being disrespectful to parents and adults because the children in the story were making fun of the adults. The parent told me that she does not teach her child these things and that the book should be taken off the shelf. I read the book myself and personally did not like the content myself either. However, I realized that the book was written, not to be disrespectful, but to be fun and entertaining for children. I did not see this as a reason to remove the book from the shelf and told the principal so. The principal allowed the book to remain on the shelf and we let the parent know the reasons why it was still there.",Midwest,Urban,1,0,0
I have contemplated putting an '8th grade only' shelf together but have been hesitant to do anything that might be considered offensive by administration. Middle school is a difficult group to purchase for because students run the gamut from very young and naive to mature and sophisticated.,Northeast,Suburban,0,1,0
"I have experienced a school administrator placing a book in his desk drawer after the parent brought it to his attention. (6th grade mother - book:What's Happening to My Body? Book for Girls. reviewed booklist, SLJ, VOYA, selected as a best book for young adults by ALA) She objected to one part about masturbation. I was not told about it until I asked the child about her overdue book and she told me that her mom had talked to the Principal about it! He gave me the book from his drawer and I put it back on the shelf. We had a challenge policy in place - I assume he did not inform her. A local elementary school had experienced a FORMAL challenge a couple of years prior that had gone all the way to the school board. The book remained in the collection.",Northeast,Suburban,0,1,0
"I have experienced many books challenges in my career (past 35 years), in IA, SD & CT in 4 different school districts. First in Iowa, in 1982, in small school district, with Headman by Kin Platt for the language in M.S. and moved it up to H.S. Library. Second and Third and Fourth in South Dakota, in 1982-84 for ""Trying Hard to Hear You"" for same sex kiss, then for Books on a Senior Independent Reading list where a Principal wanted any title that had ever been questioned removed (retained all books after lengthy explanation of Senior Students having right to choose). Then in 1984, with the MARSHALL CAVENDISH DOCTOR'S ANSWERS MEDICAL HEALTH ENCYCLOPEDIA, which had questionable pictures in the ""S"" Volume, administrator tried to pull/censor entire encyclopedia, retained the encyclopedia with restriction to ""Cover"" the pictures in that volume that adminstration ordered. Then, in 1986, in a rural town, in CT, with a joint Public and School Library, where parent kept 'checking out' then 'losing"" the VC Andrews Book ""Flowers in the Attic"" to try to censor the Library. Then in 1994, when an elementary school in our suburban school district tried to censor Goosebumps, at that time our Selection Policy and Adminstration responsible for the committee to review books in question, operated well. Goosebumps challenge resulted in the books staying on the shelves and the parent being told they may limit what their own child reads but the school would not be removing these books that were age appropriate from the library. Then in 2003, we had an Elementary School Principal pull ""Heart of a Chief"" from the Library due to a confused discussion from a parent claiming they discussed ""abortion"" in class... which was a misunderstanding... but the Selection Policy Reconsideration Policy was not followed and it took a year to get it back in the Library. Then in 2007, we had a H.S. Principal ask about E.Lockhart's ""Boy Book"" as a parent phoned about it, not wanting his daughter (15 yr old) to be allowed to check it out... and then a second book ""The boyfriend list""... as the Principal partially tried to censor by checking the two books out and sitting on them for 8 months and claimed we didn't want our girls reading a book that had a chapter on ""Boobs"" ... (a chapter was titles ""boobs"" but was just teen angst writings in a diary of sorts shared by young teen girls. Books were retained in the end, Principal never followed through with proper procedure. I sent the parent the Request for Reconsideration form, but he failed to fill it out and submit anything. You may contact me if you have any questions: Joy Parker Fitzgerald, Librarian Media Specialist, currently at a H.S. with email: librarymed@aol.com",Northeast,Suburban,0,0,1
I have found that you cannot predict challenges. The books that have been challenged during the 18 years I've worked in our school district came out of left field.,Midwest,Suburban,1,1,0
"I have had my current principal pull two books - one, a non-fiction that referenced religion and one that was a Caldecott winner. Both were brought to his attention due to a parent or teacher complaint. Neither went through the formal challenge process.",Northeast,Rural,1,1,0
"I have had only one challenge in the eight years I've worked at my school. A staff member saw a book on a cart, but she did not realize cart held weeded books so the challenge was moot. The book itself wasn't bad, but it was a) a book about a movie that was adapted from a book and b) geared toward middle grades and I work at a high school. All in all, I'm pretty happy with my challenge record because I try to make decisions that meet the needs of the entire school community and do not buy books just because they are popular, have won awards, or satisfy a single agenda.",Northeast,Suburban,0,0,1
I have had several challenges that have not passed the preliminary stages. The parents objections were met when they learned that the particular title was only one in a collection that spanned the depth of the issue involved.,Northeast,Suburban,0,0,1
"I have had several verbal challenges, but after we discuss board policy, purpose of the school library, and needs of the students, plus discussing the formal challenge procedures, the student, staff of parent has chosen not to move forward. The only guardian who chose to more forward to a formal challenge did NOT challenge having the book, Suckerpunch by David Hernandez in the library. She challenged having it as a choice for a literature circle read. We followed board policy, convened a reading committee and said it should only be a literature circle choice for 11th and 12th graders. It took a couple of months for the process and to reach a conclusion. The principal agreed with our conclusion and presented it in to the guardian and the guardian was satisfied. The board policy has changed to where the superintendent will handle book challenges. I am not sure it would play out the same way.",Mountain,Small Town,0,0,1
"I have had two books informally questions. The first book was The Boy Who Lost is Face by Sachar. Parent was concerned about language and the boy not respecting his mom. The second book was a book about the history of weapons in war. This book was first put on the shelves twelve years before I became the librarian. It remains on the shelves. The teacher (3rd grade) did not want her students bringing any books to her room that had guns. This became a non-issue in my school library when the teacher transferred to a different school. In both cases, the parties involved wanted to express their opinion, but did not want to go public with a complaint.",Mountain,Suburban,1,0,0
"I have never experienced a book challenge, but the last district I was in would not allow Ellen Hopkins to speak at one of the teen lit days. The challenge came from a parent who took it straight to the superintendent who denied the request.",South Central,Small Town,0,0,1
"I have not experienced a book challenge (but before I arrived, one student requested that a dated book on Native Americans be removed because it was not accurate). I have had one parent ask specifically that a book be restricted from the younger grades. At that time I began using an age limit sticker on books families reported were disturbing to their children. I have 4 books with such stickers. One is a book on pirates that shows them being punished by hanging. 3 are books on ghosts and hauntings. Young students may check them out if their parents give the ok. I've had 3 students get their parents' ok. I've been at my school for 20 years.",Pacific,Urban,1,1,0
I have not experienced any serious challenges. I have had specific parents speak with me about books (<5) about books they did not want their child to take out which I will honor.,Northeast,Suburban,1,0,0
"I have not had a specific book challenge here at the elementary school, but I have been involved in several book challenges at the HS level. In all cases, the book challenge procedure was followed. The book was read and reviewed by a committee of teachers, librarians, administrators, and parents. The librarians emphasized and deferred to the experienced reviewers and/or ALA recommendations to explain the purchase of the material, and in all cases, the committee recommended that the book remain in the library and available, asking that the concerned parent advise the librarian regarding reading preferences for their child only.",Northeast,Rural,1,1,0
"I have not yet been challenged on any of my books in my school library. This is our policy on controversial material: D. Controversial Material 1) Any person desiring to challenge an item must present the challenge in writing and it must be signed. 2) A committee consisting of the librarian, the principal, and one parent will be assigned to consider the criticism and make a decision about the material. 3) Item in question will remain on the shelf until a final decision has been made. Intellectual Freedom Statement: Education is best served by encouraging all learners to read broadly and well.",Mountain,Urban,0,1,1
"I have occasionally had a parent or student object to language in a book, but its very rare.",Mountain,Urban,1,0,0
"I have older administrators who take the position that sharing books where characters engage in inappropriate or risky behaviors will motivate students to emulate that behavior. That flies entirely against the pedagogy of the library but as these people determine my job stability (as year-to-year contracts are the norm here), I have to toe the line. As a result, I still buy what I am sure they consider ""controversial"" materials, I am far more careful about book-talking them and I never put them on display. This behavior goes against my professional integrity but since my school will not approve a formal book complaint process (as a means to protect both the books and my job), I am left with little choice.",Northeast,Urban,1,1,0
"I have personally experienced challenges to The Bronze Bow (parent objecting to the portrayal of Jews) and Chato's Kitchen (parent objecting to red bandana worn by Novio Boy). The Bronze Bow went through a step by step district policy and was removed from the course it was being used in due to a mismatch of curriculum, but remained in the district libraries. The district policy was initially ignored with the challenge to Chato's Kitchen, but was re-evaluated and followed policy and was reinstated to the district libraries.",Pacific,Suburban,1,1,0
"I have received two formal book challenges: one for language (swearing) and one because the book referred to a past crime involving a mass shooting in a mall (but no violent details were given). Neither challenge went far. This is my seventeenth year as a K-5 librarian and it has become increasingly difficult to avoid swearing, violence and sexual references in children's literature. I have become somewhat more lenient in what I purchase. My biggest frustration is when a terrific book for kids is very age-appropriate in every way EXCEPT for one sentence or paragraph that seems to be stuck in there for NO good reason! I see no reason for that, and it honestly makes my job much more difficult. I have had to pass up purchasing some wonderful books because of very unnecessary content that seems to be thrown in simply for shock value. Frustrating and I'd honestly like to know WHY authors do that!!",Midwest,Suburban,1,0,0
"I haven't dealt with a book challenge directly, but then I made sure that I had a sound collection development policy in place, and approved by the school administration. I have had a couple of parents object to books for their child, I emphasized to them and our students that if they have checked out a book that is not for them, return it and get another. I have a large collection, and it is possible to find something for everyone in our library.",South Central,Suburban,1,1,0
"I keep typing these answers in the wrong place. A parent challenged a non-fiction book because it was about gangs. I told him that the book was looking at the gang situation, not encouraging students to join gangs. I told him he would have to read the book if he was going to challenge it. He was mainly a Spanish speaker, so he was intimidated by that suggestion and withdrew the challenge. However, when Library Services found out about the challenge they came to my school to look at the book and had me take it off the shelf because it was an older book that they felt no longer had relevance.",Pacific,Urban,0,0,1
"I mentioned a couple of challenges on Drama, but they did not reach the formal stage. One mom (grandma) shared that she was thankful that I just listened to her and didn't make her feel stupid.",Midwest,Suburban,1,1,0
I personally have opted to not put a book on the shelf because of the graphic sexual content. It was an LGBT purchase that went into great detail about a rape and other experiences. Even for mature high school students it was a bit much. I also refused to purchase Fifty Shades of Grey novels because they are not literature and the sexual content is not appropriate for middle or high school. I had Shel Silverstein challenged as an elementary librarian but I did not remove it from the shelf.,Pacific,Urban,0,0,1
"I purchased the book This One Summer, a Caldecott honor book, because it was an award winner for children 14 and under. I was so disappointed when I received the book because the content certainly did not fall into the category of ""Children Book."" It certainly was not something that I would want any of my students to think is life today. I feel that the Caldecott committee manipulated the description for the award. It is an embarrassment to all the other Caldecott winners.",Pacific,Suburban,1,0,0
"I served on my district's review committee for challenges. As such, I voted with colleagues on whether to retain, move to another level or remove books from media collections at all levels.",South Atlantic,Suburban,1,0,0
I simply don't purchase controversial books at all. It is our philosophy that books of this nature should be purchased by the parents and discussed at home if this is the parents' wishes. It would be really refreshing if the children's book industry spent more time publishing wholesome literature for children.,Midwest,Suburban,1,0,0
I tell students they know their family. They should discuss with their family what is appropriate for them.,Northeast,Suburban,1,1,0
"I thought it was interesting on Facebook, one of my ""friends"" said that he saw that the Lorax had been considered a banned book. He was outraged that it could no longer be in school libraries. I tried to explain as best I could that just because it is considered banned, doesn't mean we have to remove it. At least I hope it doesn't, because I haven't removed any that I saw on a banned list! Those books tell me I should take a second look at the content of the book, but usually I find that it is not a relevant concern in our area or for our readers.",South Central,Small Town,1,0,0
I was a classroom teacher at the time and a parent challenged a book that a student checked out of my classroom library ( our middle school library also had the book). I applauded the parents for knowing what their child was reading and being a part of their student's reading life. I also reiterated that fact that parents have the right to monitor the books that their children but that I need to have books available for all students coming from many different families. My principal supported me on this and was present for the meeting. The parents did agree that they did not have the right to tell other parents what their kids should read nor should they want that right taken away from them. It was one meeting and was resolved on the spot.,Pacific,Suburban,0,1,0
"I was challenged by the Mr. Tucket series by Gary Paulsen. A parent told me that the book was too graphic for his child and felt that it should either be removed from the library or limited to the older students. At that time I did not have a challenge policy in place, and was new in my job. I asked one of the teachers about the book. He read it and said that it was graphically violent and he questioned the book, too. I read one of two of the series, agreed, and removed the set from the library. I wrote a letter to the parent informing him of the decision. Very soon after that I researched and came up with a policy because I did not want parents to think they could just disapprove of a book and we would automatically remove it. I have used the procedure once.",Pacific,Small Town,1,1,0
"I was working in a K-8 Catholic school and the principal and priest required me to remove The DaVinci Code from the Library. It was a book that many 8th graders were interested in reading. Though I had a formal challenge policy in place, once the priest required me to remove it, I had no choice. In a Catholic school, the priest can usurp ANY policy or procedure with ABSOLUTELY NO ROOM FOR ARGUMENT OR DISCUSSION. Ironically, in the 27 years I was a Librarian in this Catholic school, I never once had a challenge from any parent or teacher, except for this time.",Midwest,Suburban,1,0,0
"I work in a VERY conservative rural school and am from WI where Act 10 is in force and so I do not have a union to protect my job. I do not select anything very controversial because of this. I am being forced out of my job for next year because I choose to be outspoken on the way the library is run. It is only open 1/2 days which does not serve this school properly. A parent challenged the book, Julie of the Wolves that her fourth grade child read. It had an old accelerated reader tag on the book stating 4.?. I was new to the library at that time. The principal who has no idea how a library is run (and doesn't care to know) was also upset that we had a book in our library that made reference to a rape by a man of his wife. I explained to the parent that we do not restrict what students check out for the most part and that it was up to her to decide if her child should be reading a certain book. I explained where one parent would not want their child to read that kind of material another parent would be okay with it. I showed her how to log into our library from home to check what books would be acceptable for her daughter to check out and she was agreeable to it. I mentioned to her that she could have her daughter bring home the books she checked out and she could look them over before she read them. As long as I appeased the parent, I never heard from the principal about it again.",Midwest,Rural,1,1,0
"If a book is challenged anywhere in the school district, I make it a point to purchase it for the library.",Midwest,Suburban,0,1,0
"If I see a book that contradicts our selection policy, I try to find something similar with educational value",Midwest,Urban,0,0,1
"I'm fine with including books with controversial content, however, I do feel that the book should have some literary merit and be age-appropriate.",Mountain,Suburban,0,0,1
"I'm lucky because any fiction that I worry might be too much for the 6-8 graders, I can put into the high school collection, and if their parents say ok, they can check it out. I think I'd run into more challenges if I didn't have that option. I have dealt with informal challenges about language 3 times and have explained why the language in the books (all middle school) was indeed appropriate and necessary. In all 3 cases, the challenger backed down and the book stayed in the library without formal procedures. I've never had a high school challenge.",Midwest,Rural,0,1,1
In another school system but still in Iowa Harry Potter was challenged at the elementary library when it first came out. We followed the policies and the School Board recommended it stay on the shelf. The parents will told to write a letter so I would know which books their children could not check out. Years later I asked some of those now high school children if they ever read Harry Potter. They said yes but their parents still didn't know that!,Midwest,Suburban,0,0,1
"In my community, language and sexual content seem to be the hot-button issues when students and parents have shared concerns about books. I am disappointed that I often have to avoid purchasing a great book because of one or two ""f - "" words or content that is too explicitly described for a 10 - 14 year-old audience. Violence, on the other hand , has never been an issue.",Northeast,Rural,1,1,0
"In our library which serves 6th-12th grade, Accelerated Reader labels are helpful in determining age-appropriate books (ex. MG, MG+, UG).",South Central,Small Town,0,1,1
"In the past I've had parents or students express concerns with no formal action taken, but this year I've actually emailed or printed out the official district book challenge process twice. So far neither of them has actually started the process. In both cases the parents want the administrator to make the book ""disappear"" or they've wanted to start a neighborhood or Facebook-type petition to show how many others would agree with them.",Mountain,Suburban,0,1,1
"In the same evening, at a book fair, I had two different parents criticize the fairy tale books I was offering for sale. One parent thought I shouldn't be offering *any* of them; the other thought I wasn't offering *enough* of them.You can't please all of the people all of the time. As long as the principal is ok with me, I'm good!",Midwest,Suburban,1,0,0
It is challenging to provide materials engaging and relevant to 8th graders in a school that also has 6th graders.,Midwest,Suburban,0,1,0
It is very important to use review sources to purchase books for libraries as well as classrooms.,Pacific,Suburban,0,0,1
It was not an official book challenge - the parent had the 6th grade student return the book and was directed to choose something else. The book mentioned the protagonist getting her period.,Northeast,Suburban,0,0,1
