librarian_comments,region,locality,elementary_school,middle_school,high_school
"The English department had a challenge to summer reading book, but i have not had a full challenge in the Media Center. I had a parent complain about a book, which I said I would read to see for myself, and she did not follow up.",Midwest,Small Town,0,0,1
"The first challenge I experienced forced our administration (at the time they all valued libraries) to create a more specific reconsideration policy. The title went to a diverse committee who read the book and reconvened to discuss our options. The decision was made to keep the book but get parental approval in the form of a signature before allowing students to check out the book. This past school year the reconsideration policy was completely ignored when a district office staff member (bookkeeper) didn't like titles on one of my orders and brought it to the attention of the curriculum director. She removed the books from our collection, without discussing it with me, and the rest of the school year I was bullied and harassed by my building administration because I questioned the whole situation's legitimacy. Now I am very careful about what I purchase and the titles of books because I cannot survive the bullying I went through last year again and/or retain my position .",Midwest,Suburban,0,1,0
The main book challenge I faced was from my library administrator who is very sensitive to foul language. She refused to let me purchase a book students had recommended. She didn't agree with me that secondary school students can choose their own comfort level when it comes to choosing their own reading material.,Canada,Suburban,1,1,1
"The only book challenge had to do with the Stephan King series. It was the year 1991 when our junior high turned into a middle school. One parent objected to any Stephan King book available to sixth grade. When parent was asked which King book she objected to and if she had read the book, she did not pursue the challenge further.",Northeast,Suburban,0,1,0
"The only book challenge I experienced was initiated by a teacher. She took the challenge to the Principal, who said the book stays in the library. End of challenge.",South Atlantic,Suburban,1,1,0
"The only challenge I receive on a regular basis is from the kids! They often tell me that the books on the human body are inappropriate because they show ""nudity"". I usually reply that everyone has a body and they need to learn how it works, and that it is no big deal. Then they giggle and repeat the following week...",Northeast,Suburban,1,0,0
"The parent was very concerned about the Gossip Girl series. My principal just told me to pull them from the shelf and not offer them anymore. I did not purchase them; the former media specialist did. To me, parents should just say to the child just don't read those.",South Atlantic,Small Town,0,1,0
"The parent was very, very conservative and since both parents were not on the same page of being aware of haven giving consent for borrowing from YA section (it may have been a case of a forged signature by the student). Parent kept repeating that ""educators and especially librarians are too liberal and ruining our society with our introduction of leftists doctrine"" throughout our conversation, as he became more confrontational the principal wrapped up the meeting as it was obvious the book was just serving as a platform to present his narrow views and agenda and not about challenging the book. He rescinded the YA consent for his child who was a 6th grader but still loudly vocalized his opinion that the book did not belong in any collection.",Northeast,Suburban,1,1,0
The recent book challenge I had encountered was from the book entitled Drama. The parent did not appreciate the tone of the book which mentioned the gender of being gay. I was told to remove the book from the elementary school and that it may be placed in the middle school was what the administrators directed me to do. I was then questioned how book selection was decided.,Northeast,Suburban,1,0,0
"The student questioned a right-leaning college information book. Because the title could be interpreted as meaning ""correct"" rather than political-right, we added a sticker so that it was clear that it was politically leaning rather than ""correct"". I refused to remove the book because it was helpful for some of our students who would like the information in choosing a college, but the title could be misleading, so I clarified it. We have many other ""controversial"" books here, and I'm happy about that. Luckily, so is the administration and the general population of the town.",Northeast,Small Town,0,0,1
"The teacher backed down when I informed her there was a process I was going to make her go through. Her objection was to one picture in an award winning, reviewed graphic novel, where there is the impression a man is naked. I pointed out to both the teacher and the principal that my high school is an Allied Health Academy and there are numerous teaching aids of fully naked men and women through out the building, so a blurred out region in one picture in a graphic novel would not ""traumatize"" our students.",Northeast,Suburban,0,0,1
The teacher felt that the book was inappropriate due to sexual content. I discussed his concerns with him and the Dept. Chair and it was decided to keep the book on the shelf.,Northeast,Suburban,0,0,1
"There are very involved parents in this school. They often meet in the library, have functions here, etc. I am sometimes asked about books people question because of the pictures on the cover.",Northeast,Urban,0,1,1
"There was a challenge by a parent of, Rumble Fish by S. E. Hinton. We had just established a review procedure for such a challenge and followed it to the letter. It turns out the parent who filed the challenge could not possibly have read the entire book. We continued with the procedure which resulted in the retention of the title. The parent's son later checked out the book and read it in school in spite of the parents disapproval. After this challenge, staff also wanted to read, The Outsiders by S. E. Hinton and selected it for the summer reading list for our 8th Grade students.",South Atlantic,Suburban,1,1,0
"This is my third year as a librarian, following 23 years in the high school English classroom. We have had an incident where an administrator has told me that a particular student is not allowed to checkout a particular title per parent request and another incident where a student was reading the ""bad parts"" aloud to class mates and the administrator disciplined the student. We do have the YA limiter for mature content, but we also have the rare opportunity to have the public library attached to our library. Kids have access there if their parents want them to have access. I stress to students that any book could be offensive to someone, that in fact the greatest books in literature have been among the most controversial. I also encourage students to talk to their parents about what is acceptable in their own household.",Midwest,Suburban,0,1,1
"This one summer was challenged in my school by a parent who let her daughter read John Green books! I truly believe it was partly due to the fact that it is a graphic novel. She complained about the inappropriate content, and included miscarriage in that definition. I immediately got in touch with the CBLDF, the publisher, had other teachers in the building read the book to get their opinion, and went online to get as much support and information about the book as possible.",Midwest,Suburban,0,1,0
"This past year our school has seen an increase in drug use. Due to that fact, I have opted not to purchase a graphic novel that incorporates magic mushrooms as a part of the plot. Violence, vulgar language, and sex do not stop me from purchasing a title if I think my students would be interested.",Northeast,Small Town,0,0,1
Two challenges that never went beyond a discussion with the parent and an administrator.,Northeast,Suburban,1,0,0
"Two different challenges to two different books. Both challenges resulted in the school removing the book even though the Policy on Challenging Books was not followed as it should have been .This was done to satisfy the parent and avoid any further confrontation. That was an administrative decision, not a decision made by the librarian.",Northeast,Rural,0,1,1
We are a high school library and provide information for ALL students.,Northeast,Suburban,0,0,1
"We are a small community with a strong Church of Christ base so we are conservative around here. My challenge was in the elementary school over the language in a book, and it was over words like God, hell, and damn. The parent damaged the book so it was removed. It may have been ""The Great Gilly Hopkins"", but I'm not sure. It was years ago when I was an elementary librarian. I think we got another copy or already had one. I tried to tell the kids that if they didn't like something about a book (or their parents didn't, then just bring them back and get a different one). It was kind of an odd situation, and I wonder if the parent was just in a bad mood the day she saw it.",South Central,Small Town,0,0,1
"We had a parent challenge 13 Reasons Why being appropriate for 8th grade book club. The parent was angry, quoted passages (out of context of course), and copied my supt. and principal on the heated email. I sent the parent the list of all the awards the book had won as well as the links to reviewing agencies that said the book was appropriate for this grade level. The parent removed his children from book club, but didn't pursue the challenge any further.",Midwest,Small Town,0,1,0
"We have had a freshman teacher and student question a few titles, but they have not ever formally submitted a complaint. Usually when I explain that I must purchase for a wide interest of students, and some of our students read adult authors like Gresham, Sparks, & Brown. When they learn that there is a selection process and not all best sellers are entered into our collection Therefore, if they are concern with explicit content, ask and I can guide them to authors that are more to their liking.",Pacific,Suburban,0,0,1
"We have not had official challenges, but we have had an open (and generally respectful) dialogue about books for middle school readers.",Northeast,Suburban,1,1,0
We organize a banned book week yearly to make our students aware that there is such a thing in other parts of the country or the world.,Pacific,Suburban,0,1,0
"We recently had a book challenged due to some racial content and some other things. Fortunately, the committee decided to keep the book on the shelf but every time that book gets checked out now I look at who is checking it out and weigh in my mind whether or not I think the parent will approve.",South Atlantic,Suburban,1,0,0
"We would have a quarterly book challenge. If the student met their reading goal (which the classroom teacher would monitor) they would be allowed to attend the quarterly reading goal celebration. Celebrations varied and included going on a school outing to the movie theater, bowling, roller skating ice cream social, or a school dance in the gym.",Mountain,Urban,1,1,0
"When a parent challenged a book due to language, my administrator (Assistant Principal) handled the situation.",South Central,Urban,1,0,0
"When I have Library Orientation with our new 6th grade students, I tell them that our library has a very different collection from their former elementary school. Some books may not be appropriate for all students, and that they should follow their family values when they decide which books they choose to read. I also mention that sometimes waiting until you have a little more life experience will make a book even more enjoyable.",Pacific,Suburban,0,1,0
"When I started to work here in the Middle School Library, I was told there is a no restriction on books. There were books already in the library that had profanity, ect., Then a parent went to our principal and showed her a page in the book that had profanity. I was told to watch this carefully. I decided to make a teen section of the library. This makes it easy for me to view who is looking at these books and it is easy for me to know who is checking these books out. When the student checks out these books, I request a parental note. This is a general note stating that the student can check out young adult books. This has been working for the most part. some notes have come in as colorful as the books. (too descriptive). Having a note from the parent, makes me feel better. One more thing, in general I don't let my sixth graders check out these books, but if they bring me a note from parents. I let them. Also, when I receive a note, I call the parent to make sure the note came from the parent. * This was an excellent question. I must say that when ordering books, there is not enough information on content. like profanity ect. Although I worry about the content, the subject matter is what the students like and read. The students lives way more each day, then the content they read. Thanks again Middle School Librarian",Pacific,Rural,0,1,0
"When I was a public librarian the first day on the job a parent asked me not purchase the book, ""Walter the Farting Dog"" because he felt his kids said that word enough already and did not need a book that used the word too.",Northeast,Rural,1,1,0
"When I was at an elementary school, a parent had an issue with a book. My stance was okay, you can say you don't want your child to read it, but you can't make that choice for someone else's child. It ended there. Where I am now the former middle school librarian had a challenge which she should have due to the fact that she purchased books without reading them or reviewing them and it was totally inappropriate for 7th and 8th graders. The principal called her in and pulled the book and it went from there.",South Central,Small Town,0,1,1
"When I was first hired here, my principal said to use my best judgement. I am very conservative, and the first thing I got rid of was the Twilight series.",Pacific,Suburban,0,1,0
"When I was new (and not yet finished my coursework or certified) I had a parent who wanted to challenge a book. We did not have a formal challenge procedure in place. The HS librarian and I created a form based ours on the ALA recommended form and gave it to administration in case the parent chose to pursue a formal challenge. I talked him out of it with the help of his wife, who agreed that the book was appropriate for a middle school library. His daughter was in sixth grade, and he felt a book that even discussed losing virginity was inappropriate despite the fact the character was a virgin and made very positive points about staying that way. He did acknowledge that this book may not be inappropriate for an eighth grader and that the library served all the students in the building.",Northeast,Small Town,0,1,0
"When I was teaching elementary, I had a parent challenge my library on a Greek mythology book about Cronus that her son had checked out. She didn't like it because Cronus ate his own sons. I told her I would preclude her son from checking out that particular series but I would not remove the series from my collection.",Midwest,Suburban,0,0,1
"When parents begin to talk about limiting a book I ask them to read the entire book and come talk to me. Usually when they have read the full book they no longer see an issue. In past years at a school I taught (Catholic K-8), I encouraged the parent to read the book their middle school student was reading and talk about it, so that their family's beliefs and perspectives could be shared.",South Atlantic,Suburban,1,0,0
"While at the middle school, my principal told me to remove Playground by 50 Cent. The other media specialists and I took the challenge to our assistant superintendent. The book was eventually returned to the shelves, but the challenge was never directly dealt with.",Midwest,Urban,0,0,1
"While not a formal challenge, I received pressure to remove a book that dealt with kids who have a parent in jail or prison. The pressure came from the principal and the school counselor (apparently, the book was passed around when the order came in and before the book even got to the library). They were concerned that children in the school might actually be in that situation and having the book in our collection would either add to the stigma or condone the situation (of having a parent who is incarcerated). They wanted to keep it in the counselor's office for the counselor to decide whether it would be appropriate for certain students. As soon as I got out the paperwork for filing a challenge, they backed off, but I think it colored their perception of me after that. This was an elementary school.",Mountain,Suburban,0,1,0
