librarian_comments,region,locality,elementary_school,middle_school,high_school
"While I feel like the students want to read up, the politically correct atmosphere pervasive in our culture can spell trouble for librarians who don't have support of admin or board should a parent object.",Pacific,Small Town,0,1,0
Will it become an issue for parents or staff?,Midwest,Suburban,1,1,1
"With little funds to purchase books, I need to select books that will appeal to all patrons.",Mountain,Urban,1,1,0
Working for a Catholic school I have to be very careful. Books seem to have more controversial conflict.,South Atlantic,Suburban,1,1,0
"Yes, because so many books today try to ""sneak"" controversial content into the books. I am careful not to ""promote"" content that I feel is controversial and conflicting towards the values of our community. They are exposed to plenty of controversial subject matter on television. I feel responsible for supplying books and materials that are appropriate for middle school students and not subjecting them to content that they're not ready for at their age.",South Atlantic,Rural,0,1,0
"Yes, because there seem to be many more controversial stories out there.",Pacific,Rural,0,1,1
Younger children hear about edgy content and want to check out the books if we have them. This library serves students in grades 5 -12,South Central,Suburban,1,1,1
